area,source,size_m2,price_jod,price_per_m2,title
دير غبار,bayut,365,370000,1014,Flat floor with terrace apartment for sale in Hjar Al Nawabelseh 365m
دير غبار,bayut,210,220000,1048,Flat 1st floor apartment for sale in Dair ghbar 210m
دير غبار,bayut,186,175000,941,Ground floor with terrace 2023 for sale in Dair ghbar 186m
دير غبار,bayut,182,155000,852,Ground floor with terrace 2023 for sale in Dair ghbar 186m
دير غبار,bayut,186,140000,753,1st floor apartment 2023 for sale in Dair ghbar 186m
دير غبار,bayut,186,185000,995,Duplex last floor with roof 2023 for sale in Dair Ghbar 226m
دير غبار,bayut,185,182000,984,"Ground floor apartment for sale in Deir Ghbar, with an area of 185m"
دير غبار,bayut,360,280000,778,Apartment For Sale In Dair Ghbar
دير غبار,bayut,188,320000,1702,Apartment For Sale In Dair Ghbar
دير غبار,bayut,192,140000,729,Apartment For Sale In Dair Ghbar
دير غبار,bayut,260,350000,1346,Apartment For Sale In Dair Ghbar
دير غبار,bayut,100,80000,800,Ground floor apartment for for-sale in Deir Ghbar building area of 100m
دير غبار,bayut,285,200000,702,Apartment with a swimming pool for for-sale in Deir Ghbar
دير غبار,bayut,385,360000,935,Flat apartment within compound for for-sale in Deir Ghbar
دير غبار,bayut,240,180000,750,First floor apartment for for-sale in Deir Ghbar built-up area of 240m
دير غبار,bayut,230,250000,1087,Ground floor 2023 for for-sale in Dair Ghbar building area of 230m
دير غبار,bayut,230,235000,1022,Brand new first floor for for-sale in Dair Ghbar building area of 230m
دير غبار,bayut,260,320000,1231,Furnished fourth-floor for for-sale in Dair Ghbar building area of 260m
دير غبار,bayut,192,195000,1016,Newly built ground floor with terrace for for-sale in Dair Ghbar 2023
دير غبار,bayut,192,185000,964,First floor with luxurious finishes for for-sale in Dair Ghbar 2023
دير غبار,bayut,238,245000,1029,Last with roof and terrace for for-sale in Dair Ghbar building area of 238m
دير غبار,bayut,200,205000,1025,Ground floor with terrace for for-sale in Dair Ghbar building area of 200m
دير غبار,bayut,220,215000,977,Ground floor for for-sale in Hajjar Al Nabulsa (near Dair Ghbar)
دير غبار,bayut,270,220000,815,Last floor with roof for for-sale in Hajjar Al Nabulsa (near Dair Ghbar)
دير غبار,bayut,180,140000,778,flat ground floor for for-sale in Hajar Al Nabulsa building area of 180m
دير غبار,bayut,220,260000,1182,Ground floor with private garage & terrace for for-sale in Hajar Al Nabulsa
دير غبار,bayut,220,260000,1182,Ground floor (private garage) with garden for for-sale in Hajjar Al Nabulsa
دير غبار,bayut,190,135000,711,Duplex ground floor with garden for for-sale in Hajjar Al Nabulsa
دير غبار,bayut,97,78000,804,First floor for for-sale in Hajjar Al-Nawabulsa building area of 97m
دير غبار,bayut,86,66000,767,Second floor for for-sale in Hajjar Al-Nawabulsa building area of 87m
دير غبار,bayut,280,205000,732,Flat duplex with roof for for-sale in Hajjar Al-Nawabulsa building area 280m
دير غبار,bayut,255,240000,941,sixth floor duplex for for-sale in Dair Ghbar building area 250m
دير غبار,bayut,192,190000,990,Last floor with roof for for-sale in Dair Ghbar total area of 382m
دير غبار,bayut,324,260000,802,شقة مفروشة للبيع في دير غبار
دير غبار,bayut,200,210000,1050,Ground floor apartment for sale in Deir Ghbar with a building area of 200 m and a terrace area of 150 m
دير غبار,bayut,196,165000,842,"First floor apartment for sale in Deir Ghbar, total building area 196 m"
دير غبار,bayut,196,165000,842,"Second floor apartment for sale in Deir Ghbar, building area 196 m"
دير غبار,bayut,345,400000,1159,"Seventh flat floor apartment in a compound with distinctive specifications for sale in the most beautiful areas of Jordan - Dair Ghbar, building area 345 m"
دير غبار,bayut,175,220000,1257,شقة للبيع في دير غبار طابق ارضي مساحة البناء 175 م مساحة الحديقة 150 م
دير غبار,bayut,160,142000,888,Apartment For Sale In Dair Ghbar
دير غبار,bayut,200,165000,825,Apartment For Sale In Dair Ghbar
دير غبار,bayut,215,215000,1000,Apartment For Sale In Dair Ghbar
دير غبار,bayut,160,130000,812,شقة للبيع في دير غبار مساحة 160 متر بسعر مميز
دير غبار,bayut,170,190000,1118,"Ground floor apartment within a compound and with swimming pool and terrace for sale in Dair Ghbar, building area 170 m"
دير غبار,bayut,170,225000,1324,"last with roof apartment within a compound and with shared swimming pool for sale in Dair Ghbar, building area 170 m"
دير غبار,bayut,185,130000,703,First floor apartment for sale in Dair Ghbar with a building area of 185 m
دير غبار,bayut,375,300000,800,"First floor apartment for sale in Dair Ghbar, building area 375 m"
دير غبار,bayut,275,270000,982,flat apartment first floor for sale in Dair Ghbar with a built area of 275 m
دير غبار,bayut,345,380000,1101,"flat apartment Ground floor for sale in Dair ghbar with garden, building area 345 m, external area 400 m"
دير غبار,bayut,210,180000,857,furnished apartment last with roof and terrace for sale in Dair Ghbar with a total built up area of 210 m
دير غبار,bayut,460,365000,793,Flat first floor apartment for sale in Deir Ghbar with a building area of 460 m
دير غبار,bayut,79,68000,861,دير غبار شقة استثمارية للبيع مساحة 80 متر طابق اول
دير غبار,bayut,150,135000,900,دير غبار شقة مميزة للبيع موقع رائع  طابق أول سوبرديلوكس
دير غبار,bayut,280,275000,982,دير غبار شقة للبيع فخمة للبيع 280 متر طابق ثاني
دير غبار,bayut,365,190000,521,"Last floor with a distinctive roof for sale in the most beautiful areas of Deir Ghbar, an area of ​​​​365 m, at the price of a snapshot"
دير غبار,bayut,300,330000,1100,شقة طابق ارضي للبيع في اجمل احياء دير غبار مساحة الشقة 300 متر
دير غبار,bayut,90,89000.01,989,شقة للبيع مميزة جدا في دير غبار 2 نوم
دير غبار,bayut,305,210000,689,شقة للبيع في دير غبار طابق تسوية مساحة البناء 305 م
دير غبار,bayut,250,290000,1160,"Apartment with roof for sale in the most beautiful areas of Deir Ghbar, an area of ​​​​250 meters and an area of ​​​​100 meters roof, beautiful views and super deluxe specifications"
دير غبار,bayut,250,205000,820,"Apartment for sale in the most beautiful areas of Deir Ghbar, an area of ​​​​250 meters, with special specifications and at a very Good price"
دير غبار,bayut,200,200000,1000,شقة طابق ارضي فاخره للبيع في اجمال مناطق دير غبار مساحة 200 متر
دير غبار,bayut,235,160000,681,شقة للبيع المستعجل 4 نوم دير غبار حوض الرونق
دير غبار,bayut,245,215000,878,شقة طابق ثالث فاخرة للبيع في اجمل مناطق ديرغبار مساحة الشقة 245 متر
دير غبار,bayut,215,210000,977,شقة أخير مع روف دوبلكس وترسات مفروشة أو فارغة للبيع في دير غبار، مساحة بناء كلية 215 م
دير غبار,bayut,105,90000,857,شقة حديثة البناء لم تسكن للبيع في اجمل احياء عمان - دير غبار، مساحة بناء 105 م
دير غبار,bayut,105,133000,1267,شقة اول للبيع في اجمل مناطق عمان - دير غبار، مساحة بناء 105 م
دير غبار,bayut,245,234000,955,شقة ارضية دوبلكس جديدة لم تسكن للبيع في دير غبار، مساحة بناء 245 م
دير غبار,bayut,255,253000,992,شقة طابق ثاني دوبلكس جديدة لم تسكن للبيع في دير غبار، مساحة بناء 255 م
دير غبار,bayut,170,163000,959,شقة طابق اول طابقية جديدة لم تسكن للبيع في دير غبار، مساحة بناء 170 م
دير غبار,bayut,310,255000,823,شقة تسوية دوبلكس حديثة لم تسكن للبيع في دير غبار، مساحة بناء 310 م
دير غبار,bayut,400,300000,750,شقة للبيع في ديرغبار ارقى الاحياء اخير مع روف مساحة البناء 400 م مساحة الترس 60 م
دير غبار,bayut,200,265000,1325,شقة طابق ثالث مع روف دوبليكس فاخره للبيع في اجمال مناطق دير غبار
دير غبار,bayut,400,480000,1200,شقة طابقية للبيع في ارقى احياء ديرغبار
دير غبار,bayut,250,215000,860,شقة مميزة للبيع طابق اول في اجمل احياء دير غبار مساحة 250 متر
دير غبار,bayut,200,140000,700,"Apartment for sale, Deir Ghbar, behind alqima schools | 200 SQM"
دير غبار,bayut,140,145000,1036,Dair Ghbar | Ground floor apartment for sale with terrace
دير غبار,bayut,170,130000,765,Apartment for sale in Dair Ghbar 170 SQM | first floor
دير غبار,bayut,245,285000,1163,Ground floor apartment for sale in Dair Ghbar | 245 SQM
دير غبار,bayut,200,148000,740,Ground floor apartment of 200 SQM for sale in Dair Ghbar
دير غبار,bayut,220,180000,818,Distinctive apartment for sale in the most beautiful areas of Deir Ghbar | 220 SQM
دير غبار,bayut,375,340000,907,A special apartment for sale in the most beautiful areas of Dair Ghbar | 375 SQM
دير غبار,bayut,140,128000,914,New apartment for sale in Dair Ghbar | 140 SQM
دير غبار,bayut,205,155000,756,شقة طابق ارضي فاخره للبيع في اجمال مناطق دير غبار
دير غبار,bayut,200,200000,1000,شقة طابق ثالث مع روف دوبليكس فاخره للبيع في اجمال مناطق دير غبار
دير غبار,bayut,325,340000,1046,شقة طابق ارضي طابقيه فاخره للبيع في اجمل مناطق دير غبار
دير غبار,bayut,350,400000,1143,Duplex Ground Floor Apartment For Sale In Dair Ghbar | 350 SQM
دير غبار,bayut,160,130000,812,شقة طابق ثاني للبيع في اجمل مناطق ديرغبار مساحة 160 م2
دير غبار,bayut,130,120000,923,شقة طابق ارضي للبيع في اجمل مناطق ديرغبار مساحة 130 م2
دير غبار,bayut,130,105000,808,شقة طابق اول للبيع في اجمل مناطق ديرغبار مساحة 130 م2
دير غبار,bayut,130,105000,808,شقة طابق ثاني للبيع في اجمل مناطق ديرغبار | 130 م2
دير غبار,bayut,130,120000,923,شقة طابق ثالث مع روف للبيع في اجمل مناطق ديرغبار | 130 م2
دير غبار,bayut,230,225000,978,شقة طابق ارضي مميزة للبيع في اجمل مناطق ديرغبار | 230 م2
دير غبار,bayut,230,175000,761,شقة طابق ثالث مميزة للبيع في اجمل مناطق ديرغبار | 230 م2
دير غبار,bayut,230,220000,957,شقة طابق ارضي مميزة للبيع في ديرغبار | 230 م2 مع تراس
دير غبار,bayut,180,145000,806,شقة طابق اول مميزة للبيع في اجمل مناطق ديرغبار | 180م2
دير غبار,bayut,180,145000,806,شقة طابق ثاني مميزة للبيع في اجمل مناطق ديرغبار | 180م2
دير غبار,bayut,250,225000,900,First-floor apartment for sale in Dair Ghbar | 250 SQM
دير غبار,bayut,165,115000,697,شقه طابق اول للبيع في الاردن - عمان - دير غبار بمساحه 165م
دير غبار,bayut,105,84000,800,شقه طابق ثاني للبيع في الاردن - عمان -  دير غبار  بمساحه 105 متر
دير غبار,bayut,100,74000,740,شقه طابق ثالث للبيع في الاردن - عمان -  دير غبار  بمساحه 100 متر
دير غبار,bayut,105,100000,952,شقه شبه ارضي للبيع في الاردن -عمان - دير غبار بمساحه 105م
دير غبار,bayut,95,100000,1053,شقه شبه ارضي للبيع في الاردن -عمان - دير غبار بمساحه 95م
دير غبار,bayut,95,95000,1000,شقه طابق أول للبيع في الاردن - عمان - دير غبار بمساحه 95م
دير غبار,bayut,105,95000,905,شقه طابق أول للبيع في الاردن  - عمان - دير غبار بمساحه 105م 
دير غبار,bayut,95,95000,1000,شقه طابق ثاني للبيع في الاردن - عمان - دير غبار بمساحه 95م
دير غبار,bayut,95,95000,1000,شقه طابق ثالث للبيع في الاردن - عمان - دير غبار بمساحه 95م
دير غبار,bayut,275,275000,1000,شقه اخير مع روف للبيع في الاردن - عمان - دير غبار  بمساحه 275م
دير غبار,bayut,275,275000,1000,شقه طابق أرضي معلق للبيع في الاردن - عمان - دير غبار بمساحه 275م
دير غبار,bayut,275,275000,1000,شقه طابق أول للبيع في الاردن - عمان - دير غبار بمساحه 275م
دير غبار,bayut,275,275000,1000,شقه طابق ثاني للبيع في الاردن - عمان - دير غبار بمساحه 275م
دير غبار,bayut,203,150000,739,شقه طابق أول للبيع في الاردن - عمان - دير غبار بمساحه 203متر 
دير غبار,bayut,200,155000,775,شقه طابق أرضي للبيع في الاردن - عمان - دير غبار بمساحه 200متر 
دير غبار,bayut,203,140000,690,شقه شبه ارضي للبيع في الاردن - عمان - دير غبار بمساحه 203 متر
دير غبار,bayut,127,85000,669,شقه شبه ارضي طابقية للبيع في الاردن - عمان - دير غبار بمساحه 127 متر
دير غبار,bayut,223,200000,897,شقه شبه ارضي للبيع في الاردن - عمان - دير غبار بمساحه 223 متر
دير غبار,bayut,144,103000,715,شقه شبه ارضي للبيع في الاردن - عمان - دير غبار بمساحه 144 متر
دير غبار,bayut,180,160000,889,شقه طابق اول للبيع في الاردن -عمان - دير غبار 180م 
دير غبار,bayut,190,110000,579,شقه طابق تسويه  للبيع في الاردن -عمان - دير غبار 190م 
دير غبار,bayut,175,165000,943,شقه طابق ارضي للبيع في الاردن -عمان - دير غبار بمساحه 175متر 
دير غبار,bayut,135,130000,963,شقه طابق شبه ارضي للبيع في الاردن -عمان - دير غبار 135م 
دير غبار,bayut,152,160000,1053,شقق طابق اول للبيع في الاردن -عمان - دير غبار مساحة 152م
دير غبار,bayut,110,129000,1173,شقق طابق ثاني للبيع في الاردن - عمان - دير غبار بمساحه 110 متر
دير غبار,bayut,430,500000,1163,شقق طابقيه  اخير مع روف للبيع في الاردن - عمان - دير غيار  بمساحه 430م2
دير غبار,bayut,164,132000,805,شقه تسويه اولى طابقيه للبيع في الاردن - عمان - دير غبار مساحة 164م2
دير غبار,bayut,124,99000,798,تسويه خامسه للبيع في الاردن - عمان - دير غبار مساحة 124م
دير غبار,bayut,300,270000,900,طابق اول  للبيع في الاردن - عمان - دير غبار بمساحه 300م
دير غبار,bayut,300,370000,1233,طابق ارضي مع حديقه  للبيع في الاردن - عمان - دير غبار بمساحه 300م 
دير غبار,bayut,170,130000,765,طابق ثاني  للبيع في الاردن - عمان - دير غبار بمساحه 170م 
دير غبار,bayut,200,155000,775,طابق اول للبيع في الاردن - عمان - دير غبار بمساحه 200م
دير غبار,bayut,150,135000,900,طابق ارضي معلق للبيع في الاردن - عمان - دير غبار بمساحه 150م 
دير غبار,bayut,200,185000,925,طابق ارضي معلق للبيع في الاردن - عمان - دير غبار بمساحه 200م 
دير غبار,bayut,200,300000,1500,طابق ثالث  للبيع في الاردن - عمان - دير غبار بمساحه 200م 
دير غبار,bayut,114,91000,798,شقه تسويه ثالثه للبيع في الاردن - عمان - دير غبار
دير غبار,bayut,113,159000,1407,شقه طابق ثالث للبيع في الاردن - عمان - دير غبار بمساحه 113م 
دير غبار,bayut,107,151000,1411,شقه طابق ثالث للبيع في الاردن - عمان - دير غبار بمساحه 107م
دير غبار,bayut,105,136000,1295,شقه طابق ثالث للبيع في الاردن - عمان - دير غبار بمساحه 105م 
دير غبار,bayut,113,159000,1407,شقه طابق ثاني للبيع في الاردن - عمان - دير غبار بمساحه 113م
دير غبار,bayut,107,139000,1299,شقه طابق ثاني للبيع في الاردن - عمان - دير غبار بمساحه 107م
دير غبار,bayut,105,136000,1295,شقه طابق ثاني للبيع في الاردن - عمان - دير غبار بمساحه 105م 
دير غبار,bayut,113,159000,1407,شقه طابق اول للبيع في الاردن - عمان - دير غبار بمساحه 113م
دير غبار,bayut,107,139000,1299,شقه طابق اول للبيع في الاردن - عمان - دير غبار بمساحه 107م
دير غبار,bayut,105,136000,1295,شقه طابق اول للبيع في الاردن - عمان - دير غبار بمساحه 105م
دير غبار,bayut,350,300000,857,شقه طابق تسويه اولى للبيع في الاردن - عمان - دير غبار بمساحه 350م 
دير غبار,bayut,250,250000,1000,طابق ثاني مع ترس  للبيع في الاردن - عمان - دير غبار بمساحه 250م 
دير غبار,bayut,255,180000,706,شقه طابق اول للبيع في الاردن - عمان - دير غبار بمساحه 255 متر 
دير غبار,bayut,341,210000,616,شقة طابق اول للبيع في الاردن-عمان-دير غبار مساحة 341م 
دير غبار,bayut,115,116000,1009,شقه طابق ثاني للبيع في الاردن - عمان - دير غبار بمساحه 115 متر 
دير غبار,bayut,205,270000,1317,شقه طابق ثالث  للبيع في الاردن - عمان - دير غبار بمساحه 205م
دير غبار,bayut,341,425000,1246,شقه طابق اول للبيع في الاردن - عمان - دير غبار بمساحه  341 متر
دير غبار,bayut,310,300000,968,شقه طابق ثاني  للبيع في الاردن - عمان - دير غبار بمساحه 310م
دير غبار,bayut,341,460000,1349,شقه شبه ارضي للبيع في الاردن - عمان - دير غبار بمساحه 341 متر
دير غبار,bayut,350,300000,857,شقه طابق اخير مع روف للبيع في الاردن -عمان - دير غبار بمساحه 350 متر 
دير غبار,bayut,440,380000,864,شقه دوبلكس ( ارضي - اول ) للبيع في الاردن - عمان - دير غبار مساحة 440م
دير غبار,bayut,460,700000,1522,شقة اخير مع روف للبيع في الاردن - عمان - دير غبار بمساحة 460م 
دير غبار,bayut,175,155000,886,شقه طابق اول  للبيع في الاردن - عمان - دير غبار 175م 
دير غبار,bayut,250,260000,1040,شقة طابق اول للبيع في الاردن - عمان - دير غبار مساحة 250م
دير غبار,bayut,325,340000,1046,شقة طابق اخير مع روف للبيع في الاردن - عمان - دير غبار مساحة 325م
دير غبار,bayut,275,300000,1091,شقة أرضية للبيع في الاردن - عمان - دير غبار مساحة 275م
دير غبار,bayut,179,170000,950,شقه طابق أرضي للبيع في الاردن - عمان - دير غبار مساحة 179م
دير غبار,bayut,350,400000,1143,شقة  دوبلكس للبيع في الاردن - عمان - دير غبار مساحة 350م 
دير غبار,bayut,160,160000,1000,شقة دوبلكس للبيع في الاردن - عمان - دير غبار مساحة 160م
دير غبار,bayut,400,270000,675,شقه طابق اول طابقيه للبيع في الاردن - عمان-  دير غبار مساحة 400م
دير غبار,bayut,280,315000,1125,شقه طابق أرضي للبيع في الاردن - عمان - دير غبار مساحة 280م
دير غبار,bayut,85,78000,918,شقه طابق أرضي للبيع في الاردن - عمان -  ديرغبار مساحة 85 م 
دير غبار,bayut,318,525000,1651,شقه طابق أرضي  للبيع في الاردن - عمان - دير غبار مساحة 318م
دير غبار,bayut,333,230000,691,شقه طابق أول للبيع في الاردن - عمان - دير غبار بمساحه 333 متر 
دير غبار,bayut,250,195000,780,شقة طابق اول ( طابقيه ) للبيع في  الاردن - عمان - دير غباربمساحه 250متر
دير غبار,bayut,330,330000,1000,شقة طابق ارضي طابقيه للبيع في الاردن- عمان - دير غبار مساحة 330 متر 
دير غبار,bayut,260,260000,1000,شقة طابق ثالث للبيع في الاردن - عمان - دير غبار مساحة 260 متر
دير غبار,bayut,165,160000,970,شقة ارضية للبيع في الاردن - عمان -  دير غبار مساحة 165 متر
دير غبار,bayut,253,250000,988,شقة ارضيه للبيع في الاردن - عمان - دير غبار مساحة 253 متر 
دير غبار,bayut,250,300000,1200,شقه شبه ارضي مع حديقه للبيع في الاردن - عمان - دير غبار بمساحه 250م
دير غبار,bayut,205,245000,1195,شقة طابق ارضي للبيع في الاردن- عمان - دير غبار مساحة 205 متر 
دير غبار,bayut,200,225000,1125,شقه طابق اول للبيع في الاردن - عمان - دير غبار مساحته 200 م
دير غبار,bayut,235,235000,1000,شقه دوبلكس في الاردن - عمان - دير غبار للبيع بمساحه 235 م
دير غبار,bayut,147,90000,612,شقه طابق ثالث  للبيع في الاردن -عمان -  دير غبار بمساحه 147 م
دير غبار,bayut,177,130000,734,شقه طابق اول للبيع في الاردن - عمان - دير غبار بمساحه 177 متر 
دير غبار,bayut,150,110000,733,شقه طابق اول للبيع في دير غبار بمساحه 150 متر  
دير غبار,bayut,130,100000,769,شقه تسويه للبيع في الاردن - عمان - دير غبار بمساحه 130 متر 
دير غبار,bayut,330,330000,1000,شقه طابقيه ارضي و اول للبيع في الاردن - عمان - دير غبار بمساحه 330 متر 
دير غبار,bayut,278,280000,1007,طابق ارضي للبيع في الاردن - عمان -  دير غبار بمساحه 278 متر 
دير غبار,bayut,200,195000,975,شقه طابق اول للبيع في الاردن - عمان -  دير غبار بمساحه 200 متر 
دير غبار,bayut,201,260000,1294,شقه شبه ارضي للبيع في الاردن - عمان -  دير غبار بمساحه 201 متر
دير غبار,bayut,150,155000,1033,شقه طابق اول للبيع في الاردن - عمان - دير غبار بمساحه 150 متر 
دير غبار,bayut,240,185000,771,شقه طابق أول للبيع في الاردن - عمان - دير غبار مساحتها 240 متر 
دير غبار,bayut,120,90000,750,طابق ارضي للبيع في الاردن - عمان - دير غبار بمساحه 120م 
دير غبار,bayut,190,180000,947,شقه طابق ثالث للبيع في الاردن - عمان - دير غبار بمساحه 190م 
دير غبار,bayut,150,105000,700,شقه طابق ثالث للبيع في الاردن - عمان - دير غبار بمساحه 150م 
دير غبار,bayut,95,107000,1126,شقه طابق ثالث للبيع في الاردن - عمان - دير غبار بمساحه 95م 
دير غبار,bayut,150,110000,733,طابق ارضي معلق للبيع في الاردن - عمان - دير غبار بمساحه 150م
دير غبار,bayut,280,230000,821,شقه طابق اخير مع روف للبيع في الاردن - عمان - دير غبار مساحه 280 متر
دير غبار,bayut,330,399000,1209,شقه طابق اخير مع روف للبيع في الاردن - عمان - دير غبار  330متر
دير غبار,bayut,100,68000,680,شقه طابق ارضي للبيع في الاردن - عمان - دير غبار مساحه 100 متر
دير غبار,bayut,277,285000,1029,شقه طابق ثاني للبيع في الاردن - عمان - دير غبار بمساحه 277متر 
دير غبار,bayut,240,230000,958,شقه طابق اخير مع روف للبيع في الاردن - عمان - دير غبار بمساحه 240م 
دير غبار,bayut,185,160000,865,شقه طابق اول للبيع في الاردن -عمان - دير غبار مساحه 185 متر 
