area,source,size_m2,price_jod,price_per_m2,title
عبدون,qoshan,350,490000,1400,أخير مع رووف 350م دوبلكس في عبدون
عبدون,qoshan,310,450000,1452,شقة أرضية 310م مع حديقة في عبدون الشمالي
عبدون,qoshan,425,640000,1506,شقق طابقية 425م في أفضل مواقع عبدون
عبدون,qoshan,165,225000,1364,شقق 165متر في عبدون الشمالي
عبدون,qoshan,250,430000,1720,شقة طابق أول 250م بأرقى مواقع عبدون
عبدون,qoshan,220,280000,1273,شقة 220متر بسعر ممتاز في ارقى احياء عبدون
عبدون,qoshan,79,89000,1127,شقة إستثمارية مفروشة 2 نوم بالقرب من السفارة الأمريكية
عبدون,qoshan,268,230000,858,شقة 4 نوم مع مطبخ راكب في أرقى مواقع عبدون
عبدون,qoshan,315,550000,1746,شبه 4 نوم قيد الإنشاء في أفضل أحياء عبدون
عبدون,qoshan,217,315000,1452,شقة 217م بأعلى المواصفات في عبدون
عبدون,qoshan,230,450000,1957,شقق طابقية بأعلى المواصفات في عبدون
عبدون,qoshan,281,270000,961,شقة 281متر بسعر ممتاز خلف السعودية
عبدون,qoshan,156,179000,1147,شقة أرضية مميزة مع حديقة في عبدون
عبدون,qoshan,325,450000,1385,شقق 3 و 4 نوم قيد الإنشاء في عبدون
عبدون,qoshan,362,235000,649,رووف طابقي 3 نوم بأجمل اطلالة في عبدون
عبدون,qoshan,104,145000,1394,رووف إستثماري مميز في عبدون
عبدون,qoshan,280,200000,714,رووف دوبلكس بأعلى التشطيبات في عبدون
عبدون,qoshan,318,245000,770,روف 318م في احياء عبدون الشمالي
عبدون,qoshan,235,350000,1489,شقة أرضية 235م مع كراج و مدخل مستقل في عبدون
عبدون,qoshan,320,400000,1250,شقة 320م بأجمل اطلالة في أرقى مواقع عبدون
عبدون,qoshan,365,445000,1219,شقة 365 متر مع حديقة وبركة سباحة في عبدون
عبدون,qoshan,235,315000,1340,شقق 235م بمواصفات عالية في عبدون
عبدون,qoshan,262,360000,1374,شقة أرضية 3 نوم ماستر في أفضل مواقع عبدون
عبدون,qoshan,370,500000,1351,شقة 370متر في أجمل مواقع عبدون
عبدون,qoshan,300,320000,1067,رووف 300م بأعلى المواصفات وبأرقى أحياء عبدون
عبدون,qoshan,310,345000,1113,شقة أرضية 310م مع مدخل و كراج مستقل في عبدون
عبدون,qoshan,325,300000,923,شقة أرضية 205م مع بركة سباحة في عبدون
عبدون,qoshan,455,400000,879,شقة طابقية 455م في أفضل أحياء عبدون
عبدون,qoshan,275,390000,1418,دوبلكس 275متر بأجمل أحياء عبدون عبدون
عبدون,qoshan,320,290000,906,أرضية طابقية مع حديقة كبيرة في عبدون
عبدون,qoshan,141,162000,1149,شقة 141م بمواصفات عالية للبيع في عبدون
عبدون,qoshan,120,150000,1250,شقة 120متر بتشطيبات خاصة في عبدون
عبدون,qoshan,198,160000,808,شقة أرضية مع حديقة في عبدون
عبدون,qoshan,325,450000,1385,شقق بمساحات 200م – 210م للبيع في عبدون
عبدون,qoshan,281,265000,943,شقة طابقية 281م باطلالة دائمة في عبدون
عبدون,qoshan,500,795000,1590,شقق طابقية بمواصفات خاصة بأجمل مناطق عبدون
عبدون,qoshan,255,340000,1333,شقة أرضية 3 غرف نوم بأجمل مناطق عبدون
عبدون,qoshan,300,295000,983,طابقية 300م بإطلالة مميزة في عبدون
عبدون,qoshan,146,165000,1130,شقة أرضية استثمارية بموقع ممتاز في عبدون
عبدون,qoshan,470,620000,1319,شقة طابقية 470متر بأرقى أحياء عبدون
عبدون,qoshan,288,230000,799,شقة أرضية 288م بموقع مميز في عبدون
عبدون,qoshan,410,360000,878,شقة ارضية دوبلكس بأرقى مناطق عبدون
عبدون,qoshan,275,430000,1564,شقة أرضية 4نوم بأجمل مواقع عبدون
عبدون,qoshan,220,170000,773,شقة مميزة طابق أول 160 متر في عبدون
عبدون,qoshan,403,545000,1352,شقة أرضية دوبلكس في أجمل مواقع عبدون
عبدون,qoshan,560,675000,1205,شقق أرضية مع حديقة وبركة سباحة في عبدون
عبدون,qoshan,367,340000,926,شقة طابق أول 367 متر في عبدون
عبدون,qoshan,100,93000,930,شقة 100م مفروشة بالكامل في عبدون
عبدون,qoshan,275,275000,1000,شقق مميزة 275 متر في عبدون
عبدون,qoshan,295,350000,1186,شقة أرضية 295م مع حديقة كبيرة في عبدون
عبدون,qoshan,395,450000,1139,شقة أرضية دوبلكس مع حديقة كبيرة في عبدون
عبدون,qoshan,350,420000,1200,شقق 350م بأعلى المواصفات وأجمل مواقع عبدون
عبدون,qoshan,400,480000,1200,شقة أرضية دوبلكس مع 300 متر ترسات وحدائق في عبدون
عبدون,qoshan,500,595000,1190,رووف بأعلى المواصفات واطلالة مميزة في عبدون
عبدون,qoshan,450,550000,1222,شقة طابقية أرضية 450متر مع حديقة كبيرة في عبدون
عبدون,qoshan,310,375000,1210,شقة أرضية دوبلكس في أرقى مناطق عبدون
عبدون,qoshan,180,450000,2500,شقق 180 متر بتشطيبات مميزة في عبدون
عبدون,qoshan,334,385000,1153,شقة دوبلكس مميزة مع رووف  في عبدون
عبدون,qoshan,275,375000,1364,شقة طابقية شبه أرضية مع حديقة مميزة في عبدون
عبدون,qoshan,320,390000,1219,شقة أرضية على مستوى الشارع 320م مع حديقة 250م
عبدون,qoshan,430,500000,1163,شقق طابقية مميزة في أجمل مواقع عبدون
عبدون,qoshan,222,220000,991,شقة أرضي معلق 3 نوم بتشطيبات مميزة في عبدون
عبدون,qoshan,100,110000,1100,شقة أرضية 100 متر مفروشة في عبدون
عبدون,qoshan,400,400000,1000,رووف 400م في أجمل مواقع عبدون
عبدون,qoshan,300,450000,1500,رووف بإطلالة فخمة ومساحات مميزة في عبدون
عبدون,qoshan,361,295000,817,دوبلكس 361م بتشطيبات عالية في عبدون
عبدون,opensooq,173,158000,913,شقة للبيع تسوية مساحة 173م مع  وحديقه  120م اطلاله و بسعر لن يتكرر 158الف دينار  في ارقى احياء عبدون
عبدون,opensooq,200,130000,650,شقة أرضية مفروشة فاخرة للبيع في عبدون  - قرب السفارة البريطانية 200م تشطيب سوبر ديلوكس بسعر مغري
عبدون,opensooq,230,260000,1130,شقة طابق اول فاخره للبيع بعبدون مقابل السفاره السوريه بمواصفات عاليه للنخبه مساحه 230 متر
عبدون,opensooq,320,230000,719,شقة اخير مع روف للبيع في كوريدور عبدون مساحة 320م2
عبدون,opensooq,110,80000,727,شقه للبيع في عبدون المساحه 110م- 14063
عبدون,opensooq,263,209000,795,شقة فاخرة للبيع في عبدون الشمالي قرب السفارة الهولندية طابق ثاني مع روف دوبلكس263م تشطيب سوبر ديلوكس
عبدون,opensooq,450,320000,711,شقة للبيع مع تراس مساحة الشقة والتراس 450م بتطشيبات مميزة بعبدون
عبدون,opensooq,200,125000,625,شقة فاخرة للبيع في عبدون الشمالي  - قرب المركز العربي طابق ثاني 200م تشطيب سوبر ديلوكس بسعر مغري
عبدون,opensooq,225,235000,1044,شقة فاخرة للبيع في عبدون الشمالي  -  قرب المركز العربي طابق اول 225م تشطيب سوبر ديلوكس
عبدون,opensooq,300,325000,1083,شقة شبه أرضي جديدة للبيع في أجمل مواقع عبدون مساحة 300م مع ترس و حديقة 200م تشطيبات عصرية فاخرة
عبدون,opensooq,150,158000,1053,شقة مميزة في عبدون للبيع 150 متر مفروشة ومطبخ راكب تصلح للاستثمار
عبدون,opensooq,230,180000,783,شقة أرضية جديدة للبيع عبدون مساحات 230م مع تراسات و حدائق تشطيبات ديكورات سوبر ديلوكس بأسعار مميزة
عبدون,opensooq,120,89000,742,شقة استثمارية للبيع عبدون مساحة 120م طابق أول تشطيبات و فرش فاخر اطلالة جميلة بسعر مميز جداً
عبدون,opensooq,356,280000,787,فرصة نادرة لامتلاك شقة طابقية فاخرة في عبدون 356 م مربع من المالك مباشرة مجال للتفاوض
عبدون,opensooq,115,105000,913,شقة مفروشة فاخرة للبيع في عبدون  - قرب إشارة السفارة الأمريكية طابق ارضي 115م تشطيب سوبر ديلوكس
عبدون,opensooq,112,115000,1027,شقة مفروشة فاخرة للبيع في عبدون  - قرب إشارة جونيا طابق اول 112م تشطيب سوبر ديلوكس
عبدون,opensooq,260,250000,962,شقة مميزة للبيع في عبدون  -  قرب السفارة البريطانية طابق ثاني 260م تشطيب سوبر ديلوكس
عبدون,opensooq,190,205000,1079,شقة فاخرة للبيع في عبدون  -  قرب السفارة الأسترالية طابق اول 190م تشطيب سوبر ديلوكس
عبدون,opensooq,430,350000,814,رووف طابقي مميز للبيع عبدون مساحة 430م مع تراسات تشطيبات فاخرة منطقة فلل اطلالة رائعة جديد لم يسكن
عبدون,opensooq,230,165000,717,شقق جديدة للبيع في أجمل مواقع عبدون مساحات 230م تشطيبات ديكورات فاخرة اطلالة رائعة بأسعار مميزة جداً
عبدون,opensooq,230,190000,826,شقة مميزة للبيع في عبدون الشمالي  - قرب السفارة الهولندية طابق اول 230م تشطيب سوبر ديلوكس بسعر مغري
عبدون,opensooq,222,160000,721,شقه مفروشه للبيع روف222م عبدون
عبدون,opensooq,230,250000,1087,شقة فاخرة للبيع في عبدون الشمالي  -  قرب السفارة الهولندية طابق اول 230م تشطيب سوبر ديلوكس
عبدون,opensooq,260,330000,1269,شقة أرضية مميزة للبيع في عبدون الشمالي  - قرب السفارة الهولندية 260م حديقة وترسات 150م
عبدون,opensooq,155,200000,1290,شقة مفروشة فاخرة للبيع في عبدون الشمالي  - قرب السفارة اليابانية طابق ثاني 155م تشطيب سوبر ديلوكس
عبدون,opensooq,318,235000,739,روف طابقي فاخر للبيع في عبدون الشمالي  - قرب السفارة الأندونيسية 318م تشطيب سوبر ديلوكس بسعر مغري
عبدون,opensooq,175,120000,686,شقة مفروشة فاخرة للبيع في عبدون  -  قرب إشارة الملكية الأردنية طابق ثالث 175م مع روف 85م بسعر مغري
عبدون,opensooq,500,480000,960,طابق 500 متر للبيع في عبدون
عبدون,opensooq,133,170000,1278,شقة تصلح للإستثمار طابق ارضي 133م بالقرب من السفارة البريطانية في عبدون / ref 1371
عبدون,opensooq,300,345000,1150,شقة للبيع في أجمل مناطق عبدون بمساحة داخلية 300م وخارجي 250م بسعر مغري
عبدون,opensooq,290,330000,1138,في عبدون بالقرب من تاج مول و السفارة السوريه شقة شبه أرضي 290م مميزة / ref 1225
عبدون,opensooq,350,250000,714,بالقرب من تاج مول شقة طابق ثاني مفروشة جزئي 350م بسعر مميز / ref 1224
عبدون,opensooq,260,118000,454,بالقرب من السفارة السوريه في ربوة عبدون شقة طابق رابع (دوبلكس)260م بسعر مميز / ref 1226
عبدون,opensooq,230,380000,1652,شقة أرضية مميزة 230م داخلي / 50م خارجي في أجمل مناطق عبدون/ ref 4081
عبدون,opensooq,200,205000,1025,بالقرب من السفارة الهولندية شقة مفروشة شبه أرضي 200م بسعر مميز / ref 1219
عبدون,opensooq,285,250000,877,في أجمل مناطق عبدون شقة طابق أخير مع روف 285م بتشطيبات مميزة/ ref 9039
عبدون,opensooq,112,125000,1116,شقة استثمارية طابق أول 112م مفروشة في أرقى مناطق عبدون/ ref 1036
عبدون,opensooq,210,135000,643,في أرقى مناطق عبدون شقة شبه أرضي مع حديقة 210م  مفروشة  وبسعر مغري / ref 1022
عبدون,opensooq,306,310000,1013,شقة أرضية مميزه 306م في أجمل مناطق عبدون / ref 1032
عبدون,opensooq,130,135000,1038,فرصة استثمارية سكنية بالقرب من السفارة البريطانية في عبدون شقه اخير مع روف 130م مفروشة  بسعر مميز /
عبدون,opensooq,360,440000,1222,في عبدون الشمالي شقة اخير مع روف 360م بتشطيبات راقية واطلاله مميزة/ ref 1197
عبدون,opensooq,100,125000,1250,في عبدون الشمالي شقة استثمارية سكنية مفروشة طابق أول 100م بسعر مغري/ ref 1190
عبدون,opensooq,180,180000,1000,في أجمل مناطق عبدون الشمالي شقة أخير مع روف 180م مفروشة جزئي للبيع بسعر مميز / ref 1193
عبدون,opensooq,182,200000,1099,في موقع مميز في عبدون شقة طابق أول 182م بسعر مميز / ref 1028
عبدون,opensooq,210,290000,1381,بالقرب من السفارة السعودية شقةأرضية 210م في عبدون بسعر مغري / ref 1059
عبدون,opensooq,455,400000,879,تملك عقار مميز شقة أرضي معلق 455م بتشطيبات مميزة في أجمل مناطق عبدون / ref 9399
عبدون,opensooq,300,345000,1150,شبه أرضي بتشطيب فلل في أجمل مناطق عبدون بمساحة داخلية 300م وخارجي 250م بسعر مغري
عبدون,opensooq,125,160000,1280,بالقرب من السفارة الامريكيه شقه شبه أرضي 125م في أجمل مناطق عبدون /ref 1361
عبدون,opensooq,240,300000,1250,في عبدون وبالقرب من السفارة الامريكيه شقة شبه ارضي 240م تحت الإنشاء / ref 1363
عبدون,opensooq,210,231000,1100,في موقع راقي ومميز شقة أرضية 210م بمواصفات عالية وراقية جدا في أرقى مناطق عبدون / ref 9755
عبدون,opensooq,450,480000,1067,بالقرب من دوار الاسره في عبدون شقة مميزة أخير مع روف 450م بسعر مميز / ref 1165
عبدون,opensooq,240,280000,1167,في عبدون خلف السفارة البريطانية شقة أرضية 240م بسعر مميز / ref 1185
عبدون,opensooq,352,355000,1009,عقار يستحق المشاهده شقة دوبلكس (أرضيه) 352م مع حديقة 400م بسعر مميز في عبدون/ ref 9572
عبدون,opensooq,200,139000,695,في أرقى مناطق عبدون شقة مفروشة أرضي معلق 200م بسعر مميز وتشطيبات راقيه/ ref 9557
عبدون,opensooq,280,400000,1429,بالقرب من السفارة البريطانية شقة أرضية مفروشة جزئي 280م بسعر مميز / ref 1187
عبدون,opensooq,120,140000,1167,مقابل السفارة اللبنانية شقة أرضية مفروشة 120م في أرقى مناطق عبدون / ref 1183
عبدون,opensooq,150,127000,847,في موقع مميز في عبدون شقة تسوية150م مفروشة بتشطيب راقي / ref 1053
عبدون,opensooq,500,430000,860,في عبدون الجنوبي روف مميز 500م داخلي وخارجي بتشطيبات راقية وأطلاله خلابه / ref 1101
عبدون,opensooq,220,125000,568,شقة للبيع في عبدون 220 متر -14101
عبدون,opensooq,355,580000,1634,شقه أبراج عبدون الطابقية الفاخره بمساحة 355م/شبه أرضي مع ترسات خارجية و مسبح (230 متر)
عبدون,opensooq,265,675000,2547,شقه أبراج عبدون الطابقية الفاخره/ روف بمساحة 265 متر مع ترسات خارجيه 310 متر
عبدون,opensooq,355,480000,1352,شقة أبراج عبدون الطابقية الفاخره بمساحة 355م
عبدون,opensooq,225,320000,1422,شقه 225م أبراج عبدون الطابقية الفاخره /شبة ارضي مع مدخل مستقل
عبدون,opensooq,300,550000,1833,شقه للبيع بمساحة 300 متر مربع بناء جديد في عبدون ( Property 48654 )-164730
عبدون,opensooq,150,135000,900,في أجمل مناطق عبدون شقة تسوية 150م بسعر مميز / ref 1251
عبدون,opensooq,250,320000,1280,شقه 250 متر مربع للبيع في عبدون ( Property 47904 )-164547
عبدون,opensooq,250,370000,1480,شقه 250 متر مربع للبيع في عبدون ( Property 47906 )-164547
دابوق,qoshan,290,345000,1190,شقة طابق أول 290م بأعلى المواصفات في دابوق
دابوق,qoshan,230,269000,1170,شقة أرضية مع ترس و مدخل و كراج مستقل في أجمل أحياء دابوق
دابوق,qoshan,200,205000,1025,شقة 200م في أفضل مواقع دابوق للبيع
دابوق,qoshan,325,450000,1385,شقق مميزة 4 نوم بمواصفات خاصة في دابوق
دابوق,qoshan,389,410000,1054,شبه ارضي طابقي مع حديقة وبركة في دابوق
دابوق,qoshan,245,300000,1224,شقة شبه أرضي 4 غرف بإطلالة فخمة في دابوق
دابوق,qoshan,330,395000,1197,شقق طابقية 330متر في أرقى أحياء دابوق
دابوق,qoshan,430,450000,1047,رووف طابقي 4 غرف نوم بأجمل اطلالة في دابوق
دابوق,qoshan,410,350000,854,رووف طابقي 5 غرف نوم مميز في دابوق
دابوق,qoshan,430,350000,814,شقة 430متر مميزة مع ترس وكراج في دابوق
دابوق,qoshan,340,275000,809,رووف طابقي 3 نوم بأجمل إطلالة في دابوق
دابوق,qoshan,325,450000,1385,شقق مميزة 3 – 4 غرف نوم للبيع في دابوق
دابوق,qoshan,200,310000,1550,رووف طابقي 200م بأجمل إطلالة في دابوق
دابوق,qoshan,235,330000,1404,رووف مع بركة سباحة للبيع في دابوق
دابوق,qoshan,205,325000,1585,رووف طابقي بأجمل اطلالة في دابوق
دابوق,qoshan,420,400000,952,شقة طابقية 420م بإطلالة مميزة في دابوق
دابوق,qoshan,200,160000,800,شقة 200متر مفروشة بسعر ممتاز في دابوق
دابوق,qoshan,195,205000,1051,شقة 195م طابق أول بسعر ممتاز في دابوق
دابوق,qoshan,167,163000,976,شبه أرضي 3 نوم مع حديقة بأرقى أحياء دابوق
دابوق,qoshan,315,295000,937,شقة 315م بموقع مميز في دابوق
دابوق,qoshan,260,295000,1135,دوبلكس مفروشة بإطلالة مميزة في دابوق للبيع
دابوق,qoshan,200,190000,950,رووف 200 متر مع تراسات 150 متر في دابوق
دابوق,qoshan,325,450000,1385,شقق 3 نوم بأجمل مواقع دابوق للبيع
دابوق,qoshan,340,270000,794,رووف بإطلالة مميزة وتشطيبات خاصة في دابوق
دابوق,qoshan,270,210000,778,شقة مميزة مساحة 270م في دابوق
دابوق,qoshan,429,410000,956,شقة 429م مع حديقة كبيرة في أرقى مناطق دابوق
دابوق,qoshan,184,180000,978,شقة 184 متر في أجمل مناطق دابوق
دابوق,qoshan,200,150000,750,شقق 3 نوم بمساحات واسعة بموقع مميز في دابوق
دابوق,qoshan,328,360000,1098,رووف وتوب رووف 4 نوم في أرقى مناطق دابوق
دابوق,qoshan,270,245000,907,شقة شبه أرضية مع حديقة 250 متر في دابوق
دابوق,qoshan,160,225000,1406,رووف مميز١٦٠ متر مع تراسات١٨٠ متر
دابوق,qoshan,250,185000,740,شقة 250م مع حديقة كبيرة في مناطق دابوق الهادئة
دابوق,qoshan,331,265000,801,رووف مفروش بالكامل في أرقى مناطق دابوق
دابوق,qoshan,163,170000,1043,شقة طابق أول 163 متر في دابوق
دابوق,qoshan,160,160000,1000,مساحات صغيرة بأجمل مناطق دابوق
دابوق,qoshan,190,160000,842,شقة فاخرة و مفروشة للبيع بمساحة 190م في دابوق
دابوق,qoshan,170,285000,1676,رووف مميز للبيع بمساحة 170م+ 140م ترسات في دابوق
دابوق,qoshan,345,465000,1348,شقة طابقية أرضية بمساحة 315م مميزة في دابوق
دابوق,qoshan,310,445000,1435,شقة طابقية 310م ضمن سكن خاص في دابوق
دابوق,qoshan,325,150000,462,شقة مميزة للبيع بمساحة 186 م بدابوق
دابوق,bayut,500,170000,340,2 Bedrooms Apartment For Sale in Dabouq
دابوق,bayut,275,275000,1000,"4 Bedrooms Apartment For Sale Dabouq, Amman"
دابوق,bayut,160,220000,1375,Ground floor with terrace for sale in Dabouq 160m
دابوق,bayut,165,220000,1333,Ground floor with garden for sale in Dabouq 165m
دابوق,bayut,165,195000,1182,1st floor apartment for sale in Dabouq 165m
دابوق,bayut,165,240000,1455,Flat roof with terrace 2024 for sale in Dabouq 395m
دابوق,bayut,250,315000,1260,1st floor apartment for sale in Dabouq with a building area of 250m
دابوق,bayut,290,360000,1241,Apartments with garden for sale in Dabouq 290m
دابوق,bayut,230,275000,1196,1st floor for sale in Dabouq 230m
دابوق,bayut,550,550000,1000,Duplex ground floor with swimming pool for sale in Dabouq 550m
دابوق,bayut,186,165000,887,Apartment with terrace for sale in Dabouq 186m
دابوق,bayut,280,315000,1125,Apartment with swimming pool under finishing for sale in Dabouq 280m
دابوق,bayut,195,125000,641,Apartment For Sale In Dair Ghbar
دابوق,bayut,175,130000,743,Apartment For Sale In Dair Ghbar
دابوق,bayut,560,550000,982,Flat roof with terrace 2024 for sale in Dabuq 560m
دابوق,bayut,250,350000,1400,Ground floor with terrace 2024 for sale in Dabouq 250m
دابوق,bayut,250,350000,1400,1st floor apartment for sale in Dabouq under construction 250m
دابوق,bayut,250,350000,1400,Apartment with garden for sale in Dabouq 250m
دابوق,bayut,215,300000,1395,ground floor with garden for sale in Dabouq 215m
دابوق,bayut,425,325000,765,Flat roof with terrace for sale in Dabouq 425m
دابوق,bayut,195,205000,1051,1st floor apartment for sale in Dabouq with a modern design
دابوق,bayut,225,230000,1022,Ground floor with terrace for sale in Dabouq building area of 225m
دابوق,bayut,250,230000,920,Brand new 1st floor for sale in Dabouq with a building area of 250m
دابوق,bayut,475,350000,737,Flat roof with terrace for sale in Dabouq with a total area of 475m
دابوق,bayut,180,225000,1250,Flat roof with terrace 2022 for sale in Dabouq total area 385m
دابوق,bayut,240,310000,1292,Luxurious Flat apartment for sale in Dabouq 340m
دابوق,bayut,300,280000,933,Roof with terrace 2023 for for-sale in Dabouq total area of 204m
دابوق,bayut,380,380000,1000,Apartment with terraces for for-sale in Dabouq building area of 380m
دابوق,bayut,364,435000,1195,Flat ground floor apartment for for-sale in Dabouq building area of 364m
دابوق,bayut,200,165000,825,Apartment in final finishing for for-sale in Dabouq building area 200m
دابوق,bayut,190,155000,816,Apartment under final finishing for for-sale in Dabouq building area 190m
دابوق,bayut,350,465000,1329,Ground floor with terrace 2023 for for-sale in Dabouq building area of 350m
دابوق,bayut,420,675000,1607,Flat roof with terrace for for-sale in Dabuq total building area of 700m
دابوق,bayut,642,530000,826,Ground floor with swimming pool for for-sale in Dabouq building area of 640m
دابوق,bayut,367,360000,981,Flat third floor apartment for for-sale in Dabouq building area of 367m
دابوق,bayut,366,325000,888,First floor apartment for for-sale in Dabouq building area of 366m
دابوق,bayut,344,320000,930,Flat apartment with a garden for for-sale in Dabouq building area of 344m
دابوق,bayut,195,270000,1385,Ground floor with terrace for for-sale in Dabouq building area of 195m
دابوق,bayut,195,250000,1282,first floor (modern construction) for for-sale in Dabouq building area 195m
دابوق,bayut,200,330000,1650,Flat roof with terrace for for-sale in Dabouq building area of 200m
دابوق,bayut,195,260000,1333,Apartment with garden for for-sale in Dabouq building area of 195m
